{
  "tic_version": "1.0.0",
  "component": {
    "name": "perception_node",
    "build": {
      "type": "git",
      "id": "abc123def4567890",
      "image": "registry.example/perception:1.2.3"
    }
  },
  "critical_paths": [
    { "path_id": "camera->detections", "deadline_ms": 25.0, "period_ms": 33.3 }
  ],
  "uncertainty": {
    "calibration_metric": "ECE_proxy",
    "ece_max": 0.10,
    "drift_metric": "PSI_proxy",
    "drift_warn": 0.22,
    "drift_violate": 0.35
  },
  "fallback": { "state_machine": "TIER_DOWN_OR_STOP", "max_consecutive_deadline_misses": 2 },
  "observability": { "required_metrics": ["latency_ms", "uncertainty", "drift"], "min_emit_hz": 1.0 },
  "scalability": { "publish_rate_hz_max": 30, "queue_depth_max": 10, "backpressure_policy": "drop_oldest" }
}
